"Title","ID","Created Date","Updated Date","Owner","project","monthText","month","year","strategy","slug","company","Strategy","monthEnd","quarter"
"Alkalive - November 2025 - Social Media & Website Blogs Strategy","4704a2c5-de55-46fa-9f38-c9a941c6fbc1",2025-10-27T16:26:02Z,2026-01-06T11:06:22Z,"01f011dc-8d52-4de4-9524-780ccef3313b","ba7b39b5-2f96-4c6b-8d55-9e6c7cbd3ea4","november","10","2025","<p><span style=""font-weight:bold"">Monthly Deliverables:</span></p><p>Static/Carousels: 5</p><p>Reels: 1</p><p>Stories: 4</p><p>Blog: 1</p><p> </p><p><span style=""font-weight:bold"">1. Teaser &quot;Something pure is coming&quot;</span></p><p>- Minimal, cinematic close-ups of water textures and bottle silhouette.</p><p>- Use soft ripples or droplet motion for a hint of purity.</p><p>- Logo watermark (very subtle).</p><p> </p><p><span style=""font-weight:bold"">2. Official Launch &quot;Meet Alkalive&quot;</span></p><p>- shot of the bottle with sleek lighting.</p><p>- Typography overlays: Now in Jordan/ Balanced by Nature.</p><p> </p><p><span style=""font-weight:bold"">3. Product Feature &quot;The Science Behind Alkalive&quot;</span></p><p>- Frame 1: The Science Behind Balance</p><p>- Frame 2: pH 8–8.5 – Natural alkalinity.</p><p>- Frame 3: Infused with essential minerals.</p><p>- Frame 4: Pure, crisp taste.</p><p>- Frame 5: Stay balanced with Alkalive.</p><p> </p><p><span style=""font-weight:bold"">4. Brand Values &quot;The Alkalive Promise&quot;</span></p><p>- Carousel layout with large minimalist typography.</p><p>- Copy frames:</p><p>1️⃣ Purity.</p><p>2️⃣ Balance.</p><p>3️⃣ Clarity.</p><p>4️⃣ Because you deserve better water.</p><p>- Use soft light and clean water motion background.</p><p>- Consider subtle reflection of bottle at the end frame.</p><p> </p><p><span style=""font-weight:bold"">5. Lifestyle &quot;Alkalive in daily life&quot;</span></p><p>- Real-life lifestyle photography in Amman: gym, office, café, outdoors.</p><p>- Emphasize authenticity. people, not models.</p><p>- Natural lighting, neutral tones, focus on the bottle as an accessory.</p><p>- Headline overlay: “Hydrate the Alkalive Way.”</p><p> </p><p><span style=""font-weight:bold"">6. Lifestyle &amp; relatability &quot;Alkalive in motion&quot;</span></p><p>POV storytelling:</p><p>Morning jog / café / meeting / gym / sunset.</p><p>- Warm color grading with natural audio snippets (city sounds, pouring water).</p><p>- On-screen text transitions: “Start strong. Stay balanced. Stay Alkalive.”</p><p>-End frame: logo + tagline.</p><p> </p><p><span style=""font-weight:bold"">7. Testimonials &quot;Real Voices&quot;</span></p><p>- Split carousel layout featuring real testimonials.</p><p>- Frame 1: Headline “Real Voices, Real Balance.”</p><p>- Next frames: quotes from customers or influencers (with photos).</p><p>- End with “#StayAlkaliveJO Community.”</p><p> </p><p><span style=""font-weight:bold"">8. November Teaser &quot;Balance doesn’t stop here&quot;</span></p><p>- text-driven teaser.</p><p>- Copy: “Balance doesn’t stop here.”</p><p>- Abstract water movement or bottle silhouette background.</p><p>- Hint of the next theme “Alkaline Living” without revealing details.</p><p>- End with CTA: “Stay tuned.”</p><p> </p><p><span style=""font-weight:bold"">Following up to end of November</span></p><p> </p><p><span style=""font-weight:bold"">9. Education + Awareness &quot;This Is What Balance Looks Like&quot;</span></p><p>- Frame 1: “This is what balance looks like.”</p><p>- Frame 2–3: Lifestyle shots (gym, work, café, relax).</p><p>- Frame 4: Bottle close-up + tagline: “Pure. Balanced. Alive.</p><p> </p><p><span style=""font-weight:bold"">GOAL:</span></p><p>Build lifestyle association and emotional connection with Alkalive.</p><p>Visual tone: Clean, airy, real-life Jordan moments. diverse, inclusive, aspirational.</p><p>Encourage followers to relate Alkalive to their own daily balance.</p><p> </p><p><span style=""font-weight:bold"">10. Lifestyle &amp; Brand Identity (Awareness + Aspiration) &quot;More Than Water, It’s a Lifestyle&quot;</span></p><p>- Bottle shown across lifestyle scenes (gym, car, office, café).</p><p>- Goal: Reinforce brand’s premium identity and aspirational tone.</p><p>- Style: Cinematic, smooth transitions, minimalist music bed (soft ambient).</p><p>- Show Alkalive as a lifestyle symbol — not just hydration, but clarity and confidence.</p><p>- Keep Arabic-English subtitles for local relatability.</p><p>- Include end CTA overlay: “#StayAlkaliveJO.”</p>","2025-november-671389","18b7a26f-7f8a-456f-a7c6-d26aa1535fec","/strategy/2025-november-671389",11,4
"Elite Property DXB - December 2025 - Social Media & Website Blog Strategy","4b991450-6169-40fa-ac79-015b63cf3203",2025-11-24T12:14:53Z,2026-01-06T11:06:22Z,"01f011dc-8d52-4de4-9524-780ccef3313b","5dd8d88e-58bc-4e12-9cfb-55a3306b21cd","december","11","2025","<p><span style=""font-weight:bold"">Overview</span><br/>Building on November’s strong performance, December will continue to prioritise consistency, emotional storytelling, and high-quality content aligned with Elite’s position in the luxury real estate market.</p><p>The goal remains: sustained performance within healthy KPI ranges across all platforms, while reinforcing Elite as a trusted, aspirational, and people-driven brand.</p><p> </p><p><span style=""font-weight:bold"">Core Objectives</span></p><ol><li>Maintain stable reach and engagement across all platforms in line with November’s benchmarks</li><li>Strengthen community connection through storytelling and agent narratives</li><li>Position Elite as both a premium real estate brand and a top workplace for ambitious agents</li><li>Sustain quality, rhythm, and authenticity through a curated mix of lifestyle, team culture, and educational content</li></ol><p> </p><p><span style=""font-weight:bold"">Content Pillars (Continued from November)</span></p><p> </p><p><span style=""font-weight:bold"">1. Lifestyle Storytelling</span><br/>Create immersive content that captures Dubai living beyond square footage</p><p><span style=""font-weight:bold"">2. Life at Elite (Culture &amp; Growth)</span><br/>Highlight internal culture, achievements, and behind-the-scenes team moments</p><p><span style=""font-weight:bold"">3. Educational Insights</span><br/>Share valuable market knowledge and tips in clean, concise formats</p><p><span style=""font-weight:bold"">4. Agent-Focused &amp; Area Specialist Reels</span><br/>Reinforce agent presence and authority by showcasing them in the areas they specialise in</p><p><span style=""font-weight:bold"">5. Work with Elite (Recruitment)</span><br/>Feature Elite as a workplace for growth-driven, high-performing individuals</p><p><span style=""font-weight:bold"">6. CSR &amp; Community</span><br/>If applicable, feature any holiday or community engagement Elite participates in</p><p><span style=""font-weight:bold"">7. Agent Spotlight</span><br/>Continue weekly spotlight features to build team visibility and human connection</p><p> </p><p><span style=""font-weight:bold"">Suggested December Additions</span></p><ul><li><span style=""font-weight:bold"">2025 Market Predictions:</span> Feature agent insights about upcoming trends in carousel or reel format</li><li><span style=""font-weight:bold"">Elite Wrapped:</span> Recap wins, milestones, and top content of the year</li><li><span style=""font-weight:bold"">Festive Lifestyle Content:</span> Subtle holiday moments that reflect Dubai’s luxury lifestyle</li><li><span style=""font-weight:bold"">Year-End Agent Appreciation:</span> Celebrate achievements and set the tone for January</li></ul><p><span style=""font-weight:bold"">Summary</span></p><p> </p><p>December’s strategy is focused on consistency, storytelling, and staying top of mind. By continuing the successful formula from November and layering in seasonal content, Elite can maintain performance and brand equity through the year-end period.</p>","2025-december-710659","56eac7e9-af94-47c0-b4b1-2a4101a9b0c1","/strategy/2025-december-710659",11,4
"Elite Property DXB - Q1 2026 - Social Media & Website Blogs Strategy","503fc6bb-dbb0-469f-85b1-c998da9666db",2026-01-05T08:55:11Z,2026-01-26T07:30:13Z,"01f011dc-8d52-4de4-9524-780ccef3313b","5dd8d88e-58bc-4e12-9cfb-55a3306b21cd","january","0","2026","<p><span style=""font-weight:bold"">Content Strategy Overview</span></p><p> </p><p>For Q1, our approach is to <span style=""font-weight:bold"">streamline content</span>, <span style=""font-weight:bold"">boost storytelling</span>, and <span style=""font-weight:bold"">double down on formats that drove leads and engagement in 2025</span>. With refined focus, each platform will serve a distinct role in the conversion funnel, guiding general audiences down to high-intent clients.</p><p> </p><p><span style=""font-weight:bold"">Top performing post of 2025 to adopt</span></p><ul><li><span style=""font-weight:bold"">Culture-Driven Content</span><br/>Human-centric content continues to dominate. Plan weekly team reels, behind-the-scenes, celebrations, and lifestyle moments that reflect Elite’s dynamic work culture.</li><li><span style=""font-weight:bold"">Agent Spotlights &amp; Educational Stories</span><br/>Bite-sized, value-driven posts showcasing agent wins, area knowledge, and process breakdowns (e.g. “Buying in Dubai 101”, “Golden Visa guides”) — ideally in Reel/Carousel formats.</li><li><span style=""font-weight:bold"">Story-Based Property Tours</span><br/>Focus on cinematic, VO-led walkthroughs with emotional narrative. Use <span style=""font-weight:bold"">YouTube for long-form</span>, Instagram Reels and TikToks for vertical teasers. Highlight lifestyle, not just specs.</li><li><span style=""font-weight:bold"">Relatable Agent Humor &amp; Bloopers</span><br/>Lean into authentic moments to balance the feed. Low-lift, high-engagement, especially for TikTok.</li><li><span style=""font-weight:bold"">Cinematic POV Reels</span><br/>Enhance these with storytelling — use text overlays, voiceovers or agent commentary. Best for Instagram Reels and TikTok.</li><li><span style=""font-weight:bold"">Salesy Ads / Launch Posts</span><br/>These underperformed unless paired with high visuals or value. <span style=""font-weight:bold"">Repurpose for paid only</span>, supported by Luxebridge. Remove from organic unless it’s a trophy listing.</li></ul><p> </p><p><span style=""font-weight:bold"">Platform Roles &amp; Funnel Positioning</span></p><ul><li><span style=""font-weight:bold"">TikTok<br/>Role:</span> Branding &amp; Awareness<br/><span style=""font-weight:bold"">Audience:</span> General public, global viewers<br/><span style=""font-weight:bold"">Focus Content:</span> POV reels, Dubai lifestyle, funny agent content, transformations</li><li><span style=""font-weight:bold"">Instagram<br/>Role:</span> Discovery &amp; Engagement<br/><span style=""font-weight:bold"">Audience:</span> Homeowners, tenants, investors, agents<br/><span style=""font-weight:bold"">Focus Content:</span> Cinematic property tours, agent reels, educational carousels, UGC, stories</li><li><span style=""font-weight:bold"">LinkedIn<br/>Role:</span> Agent Recruitment &amp; Branding<br/><span style=""font-weight:bold"">Audience:</span> Agents, brokers, career switchers<br/><span style=""font-weight:bold"">Focus Content:</span> Team wins, promotions, job openings, thought leadership</li><li><span style=""font-weight:bold"">YouTube<br/>Role:</span> Long-Form &amp; Property Immersion<br/><span style=""font-weight:bold"">Audience:</span> Global investors, high-intent buyers<br/><span style=""font-weight:bold"">Focus Content:</span> Chaptered cinematic property tours, Dubai neighbourhood series, educational long-form</li><li><span style=""font-weight:bold"">Facebook<br/>Role:</span> Paid Campaigns Only<br/><span style=""font-weight:bold"">Audience:</span> Older, high-net-worth audiences<br/><span style=""font-weight:bold"">Focus Content:</span> Paid ad content only (managed by Luxebridge)</li></ul><p> </p><p><span style=""font-weight:bold"">Monthly Deliverables</span></p><ul><li>8 Reels/month (culture, tours, agent content, POV)</li><li>4 Static Posts/month (carousel tips, spotlights, quotes)</li><li>2 Long-form YouTube uploads (property tours, area guides)</li><li>4–6 Stories/week with CTAs, behind-the-scenes, polls, UGC</li></ul><p> </p><p><span style=""font-weight:bold"">Refinements &amp; Experiments</span></p><ul><li>Remove static “salesy” listings unless high-ticket or story-led</li><li>Focus on high-production property videos with VO + narrative</li><li>Layer in humour + UGC moments to avoid over-curated aesthetic</li><li>Keep ad-focused assets with Luxebridge for paid only</li></ul>","2026-january-710659","56eac7e9-af94-47c0-b4b1-2a4101a9b0c1","/strategy/2026-january-710659",2,1
,"551bc1b5-bfff-4c2a-b937-2ca58247cea6",2025-08-04T13:06:53Z,2026-01-06T11:06:22Z,"01f011dc-8d52-4de4-9524-780ccef3313b","5dd8d88e-58bc-4e12-9cfb-55a3306b21cd","june","5","2025",,"2025-june-710659","56eac7e9-af94-47c0-b4b1-2a4101a9b0c1","/strategy/2025-june-710659",5,2
"Sovereign Capital - Q1 2026 - Social Media Marketing & Website Blogs Strategy","57e50246-5b73-48e9-b299-a7e8e4241ba8",2026-01-26T07:30:52Z,2026-02-09T06:09:53Z,"01f011dc-8d52-4de4-9524-780ccef3313b","fe6eef75-85a6-4b38-9c21-2c3079846288",,"0","2026","<p><span style=""font-weight:bold"">Sovereign Capital – Main Content Objectives</span></p><ul><li><span style=""font-weight:bold"">Establish Sovereign Capital as a trusted long-term real estate advisory</span> in Abu Dhabi, not a transactional brokerage, by leading with insight, judgement, and clarity</li><li><span style=""font-weight:bold"">Build investor confidence before the first conversation</span> through consistent, considered content that demonstrates understanding of market fundamentals, risk, and long-term value</li><li><span style=""font-weight:bold"">Position Sovereign Capital as Abu Dhabi specialists</span>, showcasing deep local knowledge of neighbourhoods, culture, and investment dynamics beyond price and listings</li><li><span style=""font-weight:bold"">Communicate authority and credibility without sales pressure</span>, using education-led content that explains how intelligent capital behaves in Abu Dhabi</li><li><span style=""font-weight:bold"">Differentiate Sovereign Capital through its decision-making process</span>, clearly articulating how investments are evaluated, filtered, and prioritised</li><li><span style=""font-weight:bold"">Reflect the Elite Property DXB pedigree while building an independent Abu Dhabi identity</span>, aligned with higher standards, global practices, and long-term relationships</li><li><span style=""font-weight:bold"">Attract serious, high-intent investors</span> who value stability, legacy, discretion, and informed decision-making over speed or speculation</li><li><span style=""font-weight:bold"">Embed legacy as a core strategic theme</span>, reinforcing long-term thinking through consistency, restraint, and a refusal to chase trends</li><li><span style=""font-weight:bold"">Create warmer, more informed sales conversations</span>, where investors arrive educated, aligned, and already familiar with Sovereign’s philosophy</li><li><span style=""font-weight:bold"">Build a brand presence designed to last</span>, prioritising trust, recall, and reputation over volume, virality, or short-term performance metrics</li></ul><p><span style=""font-weight:bold"">1- What the Content Strategy Is (and What It Is Not)</span></p><p> </p><p><span style=""font-weight:bold"">The Role of Content at Sovereign Capital</span></p><p>Sovereign Capital’s content strategy is not designed to generate short-term leads or promote listings.<br/>It exists to build investor confidence, establish authority, and signal long-term intent in Abu Dhabi’s real estate market.</p><p>- Content is used as an <span style=""font-style:italic"">extension of the advisory process</span>.</p><p>- Where most real estate brands communicate availability, Sovereign communicates judgement.</p><p>- Where the market speaks in urgency, Sovereign speaks in clarity.</p><p> </p><p>Content is how Sovereign earns trust before the first conversation.</p><p> </p><p><span style=""font-weight:bold"">2- Brand-Aligned Content Principles</span></p><p>All content must consistently reflect the following:</p><p> </p><p><span style=""font-weight:bold"">Tone of Voice</span></p><ul><li>Calm</li><li>Confident</li><li>Clear</li><li>Considered</li></ul><p><span style=""font-weight:bold"">What we explicitly avoid:</span><br/>Sales language, urgency, hype, promises, scripted hooks, over-explanation.</p><p><span style=""font-weight:bold"">Visual Language</span></p><ul><li>Editorial framing</li><li>Real locations, real architecture, real environments</li><li>Slow pacing, natural light</li><li>Minimal typography, restrained overlays</li></ul><p>Content should feel timeless, not trend led.</p><p> </p><p><span style=""font-weight:bold"">3. Content Pillars (Strategic Use, Not Volume)</span></p><p>Sovereign’s content pillars are not content “categories” they are signals.<br/>Each pillar exists to communicate something specific to a high-value investor.</p><p> </p><p><span style=""font-weight:bold"">Pillar 1: Investor Intelligence</span></p><p><span style=""font-weight:bold"">Purpose:</span> Authority &amp; credibility<br/> <span style=""font-weight:bold"">Role:</span> Educate without overwhelming</p><p>This pillar explains <span style=""font-style:italic"">how intelligent capital behaves</span> in Abu Dhabi.</p><p> </p><p><span style=""font-weight:bold"">Pillar 2: Provenance &amp; Place</span></p><p><span style=""font-weight:bold"">Purpose:</span> Local depth &amp; market truth<br/> <span style=""font-weight:bold"">Role:</span> Demonstrate understanding of <span style=""font-style:italic"">place</span>, not products</p><p>This content shows that Sovereign understands Abu Dhabi beyond price per square foot.</p><p> </p><p><span style=""font-weight:bold"">Pillar 3: The Sovereign Way (Thought Process)</span></p><p><span style=""font-weight:bold"">Purpose:</span>Differentiation<br/> <span style=""font-weight:bold"">Role:</span> Explain <span style=""font-style:italic"">how decisions are made</span></p><p>This pillar communicates Sovereign’s internal filters, standards, and discipline.</p><p> </p><p><span style=""font-weight:bold"">Pillar 4: Foundation, Trust &amp; Legacy</span></p><p><span style=""font-weight:bold"">Purpose:</span> Emotional confidence<br/> <span style=""font-weight:bold"">Role:</span> Build belief without testimonials</p><p>This pillar humanises the brand quietly, without performance or sales pressure.</p><p> </p><p><span style=""font-weight:bold"">4- Legacy as a Strategic Theme (Not a Campaign)</span></p><p> </p><p>Legacy at Sovereign Capital is not expressed through nostalgia or heritage visuals.<br/>It is expressed through restraint, consistency, and long-term thinking.</p><p>Legacy is shown by:</p><ul><li>Repeating core beliefs over time</li><li>Consistent refusal to chase trends</li><li>Emphasis on process over outcomes</li><li>Calm confidence in messaging</li></ul><p>This mirrors how legacy investors behave.</p><p> </p><p><span style=""font-weight:bold"">5. Target Audience (High-Intent, Clearly Defined)</span></p><p>Sovereign Capital does not speak to the mass market.</p><p> </p><p><span style=""font-weight:bold"">Primary Audiences</span></p><p><span style=""font-weight:bold"">5.1- Global Capital Diversifiers</span></p><ul><li>International investors seeking AED-pegged stability</li><li>Comparing Abu Dhabi with London, New York, Singapore</li><li>Expect data, context, and discretion</li></ul><p><span style=""font-weight:bold"">5.2- GCC &amp; Local HNWIs</span></p><ul><li>Focused on intergenerational wealth</li><li>Value reputation, relationships, and privacy</li><li>Interested in stability over speed</li></ul><p><span style=""font-weight:bold"">5.3- High-Earning Professionals Relocating to Abu Dhabi</span></p><ul><li>Tech, finance, leadership roles</li><li>Seeking clarity in an unfamiliar market</li><li>Distrust traditional sales agents</li></ul><p><span style=""font-weight:bold"">Audience Mindset</span></p><ul><li>Risk-aware</li><li>Reputation-driven</li><li>Long-term oriented</li><li>Intolerant of hype</li></ul><p>Content must feel like it respects their intelligence.</p><p> </p><p><span style=""font-weight:bold"">6. Strategic Outcome of the Content Strategy</span></p><p>When executed correctly, Sovereign Capital’s content will result in:</p><ul><li>Warmer, more informed client conversations</li><li>Investors referencing Sovereign content before meetings</li><li>Strong brand recall without high posting frequency</li><li>Credibility that precedes sales discussions</li></ul><p>Success looks like trust arriving before demand.</p><p> </p><p><span style=""font-weight:bold"">7. Final Strategic Positioning</span></p><p><span style=""font-weight:bold"">Sovereign Capital’s content strategy positions the brand as:</span></p><p>- A long-term real estate advisory,<br/>- Rooted in Abu Dhabi,<br/>- Built on trust,<br/>- Designed for legacy capital.</p><p> </p><p>This is not content designed to be loud.<br/> <span style=""font-weight:bold"">It is content designed to last.</span></p>","2026-january-36383","88853dfe-2ab3-4c64-927e-2660e88af0d9","/strategy/2026-january-36383",2,1
"Crypto Homes DXB - September 2025 - Social Media Strategy","5b47738e-e908-45ad-b8e1-abe917b219c1",2025-08-26T07:06:23Z,2026-01-06T11:06:22Z,"e771b8d5-2d78-4471-bb22-0c0d9e29a888","90f5bb8e-1da9-441f-b63b-1941b663318b","september","8","2025","<p>For September, our goal is to continue to position Crypto Homes DXB as the go-to authority for crypto-backed property investments, while educating and engaging both crypto enthusiasts and real estate investors.</p><p> </p><p><span style=""font-weight:bold"">Content Pillars</span></p><p> </p><p><span style=""font-weight:bold"">1. Education &amp; Awareness (Crypto + Real Estate Basics)</span></p><p><span style=""font-style:italic"">Goal: Build trust and visibility by simplifying complex ideas.</span></p><ul><li>Reels: Quick explainers on crypto terms, blockchain in real estate, FAQs (“What makes a property crypto-ready?”).</li><li>Static/Carousel: Step-by-step guides (“How to buy property with Bitcoin in Dubai”), infographics on crypto adoption.</li><li>Stories: Polls and quizzes to test audience knowledge (“Would you buy a villa with crypto?”).</li></ul><p> </p><p><span style=""font-weight:bold"">2. Market Insights &amp; Trends</span></p><p><span style=""font-style:italic"">Goal: Showcase credibility and thought leadership.</span></p><ul><li>Reels: “This week in Dubai real estate &amp; crypto” (bite-sized updates).</li><li>Static/Carousel: Market snapshot graphics with stats (visitor numbers, property yields, crypto adoption news).</li><li>LinkedIn: Long-form posts from founders discussing regulation, tokenisation, and investor trends.</li></ul><p> </p><p><span style=""font-weight:bold"">3. Engagement &amp; Entertainment</span></p><p><span style=""font-style:italic"">Goal: Keep audiences hooked with relatable, viral content.</span></p><ul><li>Reels: Quiz and trend-based formats tied to crypto investing (“POV: You bought property with BTC in Dubai”).</li><li>Stories: AMA sessions, “This or That” style polls (“Palm villa or Marina penthouse?”).</li></ul><p> </p><p><span style=""font-weight:bold"">4. Jake’s Take: Crypto &amp; Property Unlocked</span></p><p><span style=""font-style:italic"">Goal: Position Jake Jones as a <span style=""font-weight:bold"">thought leader</span> while giving the audience long-form, conversational value.</span></p><ul><li><span style=""font-weight:bold"">Engagement Tie-In</span>: Ask listeners to send in questions → answered in future episodes → repurposed as short-form Q&amp;A Reels.</li></ul><p> </p><p><span style=""font-weight:bold"">5. How to Use the Website (Guides &amp; Walkthroughs)</span></p><p><span style=""font-style:italic"">Goal: Drive traffic to the platform and make it easier for users (buyers, sellers, and partners) to understand and take action on Crypto Homes DXB.</span></p><ul><li>Short tutorials like <span style=""font-style:italic"">“How to search crypto-ready properties in 20 seconds”</span>.</li><li>Walkthroughs showing the process of filtering listings by location or crypto payment option.</li><li>“POV” skits (user browsing → finding a villa → clicking ‘inquire’).</li><li>Step-by-step graphics: <span style=""font-style:italic"">“How to register as a buyer”</span>, <span style=""font-style:italic"">“How to list your property”</span>, <span style=""font-style:italic"">“How agencies can partner with us”</span>.</li><li>Screenshots with arrows/highlights to show where to click for key actions.</li></ul>","2025-september-29250","cc1e8c94-1f3d-4942-ba0a-3f5041a105cc","/strategy/2025-september-29250",8,3
,"5c105d3d-a757-473a-be41-6149311cb9cd",2025-09-02T12:54:02Z,2026-01-06T11:06:22Z,"01f011dc-8d52-4de4-9524-780ccef3313b","f889f811-6e7f-489d-a7de-dee3fc249d28","september","8","2025",,"2025-september-436945","426d8f37-fc41-444b-ab15-e9fc7bbb0933","/strategy/2025-september-436945",,
,"6872dcfc-d32b-4e36-8349-2897ef967972",2025-10-16T10:09:12Z,2026-01-06T11:06:22Z,"01f011dc-8d52-4de4-9524-780ccef3313b","160e00a4-309a-40b8-aec3-1635e37cf211","october","9","2025",,"2025-october-483409","5ce89196-d503-4960-a087-3d0d94018925","/strategy/2025-october-483409",,
