"Title","ID","Created Date","Updated Date","Owner","project","monthText","month","year","strategy","slug","company","Strategy","monthEnd","quarter"
"Crypto Homes DXB - October 2025 - Social Media & Website Blog Strategy","a5db7634-067f-432e-8771-cba6ce40e9ff",2025-09-22T08:30:35Z,2026-01-06T11:06:22Z,"01f011dc-8d52-4de4-9524-780ccef3313b","90f5bb8e-1da9-441f-b63b-1941b663318b","october","9","2025","<p>This month balances <span style=""font-weight:bold"">thought leadership, engagement, and direct property promotion</span>. It leans on Jake &amp; Aaron’s credibility, delivers timely market insights, and introduces property-focused content tied directly to the website.</p><p> </p><p><span style=""font-weight:bold"">Content Formats</span></p><p>Video Content – 8 + 2 (carry over from July)</p><p>Image Content – 8<br/>Stories - 8</p><p> </p><p><span style=""font-weight:bold"">1. Jake’s Take (Crypto &amp; Property Unlocked) – Featuring Jake &amp; Aaron</span></p><ul><li>Long-form insights from Jake and Aaron about crypto real estate trends.</li><li>Formats:</li><ul><li>Reels with Q&amp;A snippets from both (audience-submitted questions).</li><li>LinkedIn articles positioning them as thought leaders.</li></ul><li>Goal: Strengthen credibility, make the brand more personal and authoritative.</li></ul><p> </p><p><span style=""font-weight:bold"">2. Market Insights &amp; Trends</span></p><ul><li>Weekly updates on Dubai real estate + crypto adoption.</li><li>Formats:</li><ul><li><span style=""font-weight:bold"">Reels</span>: “Crypto News”</li><li><span style=""font-weight:bold"">Carousels</span>: Stats + graphics (e.g., property yields, transaction volumes, crypto adoption rates).</li><li><span style=""font-weight:bold"">Stories</span>: Polls like “Do you think tokenisation is the future of real estate?”</li></ul><li>Goal: Showcase Crypto Homes as the go-to source for trustworthy news.</li></ul><p> </p><p><span style=""font-weight:bold"">3. Engagement &amp; Entertainment (Quiz Reels)</span></p><ul><li>Keep audiences engaged with interactive formats.</li><li>Formats:</li><ul><li>“Myth or Fact” quiz reels.</li><li>Polls  in Stories to test crypto/real estate knowledge.</li><li>Quick “POV” memes (e.g., “POV: You bought your first villa with Bitcoin”).</li></ul><li>Goal: Drive comments, shares, and story interactions.</li></ul><p> </p><p><span style=""font-weight:bold"">New October Additions</span></p><p> </p><p><span style=""font-weight:bold"">4. Property Tour Reels</span></p><ul><li>Walkthroughs of listed properties to spark curiosity and encourage website visits.</li><li>Content:</li><ul><li>Showcase interiors, exteriors, and lifestyle around the property.</li></ul><li>Goal: Encourage viewing listings on the website.</li></ul><p> </p><p><span style=""font-weight:bold"">5. Property Carousels (with Crypto Prices)</span></p><ul><li>Static posts displaying properties with both AED and crypto price equivalents  (BTC).</li><li>Stories promoting hot listing and links to website</li><li>Goal: Position Crypto Homes as the hub for crypto property buyers while boosting website traffic.</li></ul><p> </p><p><span style=""font-weight:bold"">Minimum views per video content (Organic + Boosted):</span></p><ul><li>2k on IG</li><li>5k on TikTok</li><li>500 on LinkedIn</li></ul><p> </p><p><span style=""font-weight:bold"">Boosting Strategy</span></p><ul><li>Promote all reels initially at AED 50.00 minum, allocate more budget on best performing reels at AED 100.00 per reel.</li><li>Additional budget allocation to property tour reels at AED 100.00 per reel</li></ul>","2025-october-29250","cc1e8c94-1f3d-4942-ba0a-3f5041a105cc","/strategy/2025-october-29250",11,4
,"a68ab89d-c5b3-48c7-8ee6-c99bde84e38d",2025-10-03T06:47:14Z,2026-01-06T11:06:22Z,"01f011dc-8d52-4de4-9524-780ccef3313b","c27ec391-f198-49d2-a60e-6a3516fb252b","october","9","2025","<p>For October, the strategy is designed to announce and cement the HORECA 2026 rebrand, clearly communicating its expanded scope: Connecting Hotels, Restaurants &amp; Catering - establishing it as Libya&#x27;s leading hospitality platform.</p><p> </p><p>Content Formats:</p><p>6 Reels</p><p>8 Stories</p><p> </p><p><span style=""font-weight:bold"">Theme: </span>Connecting Hotels, Restaurants &amp; Catering Under One Roof</p><p> </p><p><span style=""font-weight:bold"">Content Pillars:</span></p><p>1. The Rebrand: Announcement of HORECA</p><p><span style=""font-style:italic"">Goal: To establish the shift from ‘The RNF Show’ to ‘HORECA’ and position the event as the leading leadership platform for the entire hospitality ecosystem in Libya.</span></p><p> </p><p>2. The Value Proposition: HORECA Libya 2026 Preview</p><p><span style=""font-style:italic"">Goal: To answer &quot;What&#x27;s in it for me?&quot; for the attendees and exhibitors</span></p><p> </p><p>3. The Call to Action: Be Part of It</p><p><span style=""font-style:italic"">Goal: To convert the awareness and interest from the first two pillars into registrations</span></p>","2025-october-24990","448570ff-ae32-45a3-8790-5bca1175adae","/strategy/2025-october-24990",,
"Crypto Homes DXB - July 2025 - Social Media Strategy","af4996a3-cb57-4210-afcf-186662ce5cac",2025-08-03T21:03:22Z,2026-01-06T11:06:22Z,"01f011dc-8d52-4de4-9524-780ccef3313b","90f5bb8e-1da9-441f-b63b-1941b663318b","july","6","2025","<p><span style=""font-weight:bold"">Objective:</span><br/>Establish brand presence, build credibility, and attract a niche audience of crypto-savvy investors and modern property buyers.</p><p> </p><p><span style=""font-weight:bold"">Primary Goals</span></p><ol><li><span style=""font-weight:bold"">Brand Awareness:</span> Introduce Crypto Homes DXB as a trailblazer in crypto-backed real estate transactions.</li><li><span style=""font-weight:bold"">Educate &amp; Engage:</span> Simplify crypto + property for first-time buyers and investors.</li><li><span style=""font-weight:bold"">Build Community:</span> Grow an engaged, loyal audience via content, storytelling, and interaction</li></ol>","2025-july-29250","cc1e8c94-1f3d-4942-ba0a-3f5041a105cc","/strategy/2025-july-29250",8,3
"Airstay Holiday Homes - December 2025 - Social Media Strategy","b1101306-0672-4edb-aba0-31434c5248b6",2025-11-25T12:53:53Z,2026-01-07T12:08:35Z,"01f011dc-8d52-4de4-9524-780ccef3313b","1212678d-037b-475a-b187-a27821e2d3c8","december","11","2025","<p>For December, our strategy will focus on delivering holiday-themed, emotionally rich, and destination-driven content that positions Airstay as the top choice for travellers. Every piece of content will highlight comfort, family moments, and the magic of spending the season in Dubai.</p><p> </p><p><span style=""font-weight:bold"">Core Goals:</span></p><ul><li>Build emotional connection through festive and family-oriented content</li><li>Increase engagement and share-worthy posts during peak season</li><li>Demonstrate Airstay’s value through location, comfort, and guest experience</li><li>Highlight Dubai as the ideal December destination</li><li>Strengthen Airstay’s brand authority through leadership insights (Timothy’s Take)</li></ul><p> </p><p><span style=""font-weight:bold"">Deliverables:</span></p><p>4 Reels</p><p>4 Carousels</p><p>8 Stories</p><p> </p><p><span style=""font-weight:bold"">Content Pillars:</span></p><p><span style=""font-weight:bold"">1. Holiday-Themed Content</span></p><p><span style=""font-style:italic"">Goal: Create a fun, cosy, and festive atmosphere that encourages guests to choose Airstay for their seasonal stays.</span></p><p> </p><p>Format:</p><p>Reels: “Celebrate the Holidays at Airstay Holiday Homes,” “Festive Date Night”</p><p> </p><p><span style=""font-weight:bold"">2. Dubai as the Perfect Holiday Destination</span></p><p><span style=""font-style:italic"">Goal: Showcase why Dubai is a dream December getaway: iconic locations, festive events, incredible views, and how Airstay completes the experience.</span></p><p> </p><p>Format:</p><p>Reel: “A Day in Dubai During the Holidays”</p><p> </p><p><span style=""font-weight:bold"">3. Family &amp; Togetherness</span></p><p>Goal: Tap into emotional storytelling that highlights family warmth, shared traditions, and holiday bonding inside Airstay homes.</p><p> </p><p>Format:</p><p>Reel: “Small moments that feel big” (POV lifestyle shots), Emotional storytelling panels (“This is where memories happen…”)</p><p> </p><p><span style=""font-weight:bold"">4. Timothy’s Take</span></p><p><span style=""font-style:italic"">Goal: Strengthen authority, trust, and brand credibility by sharing leadership perspectives and market insights directly from Timothy.</span></p><p> </p><p>Format:</p><p>Blog: Key market trends for December, short insights on guest behaviour and seasonal travel</p><p> </p><p><span style=""font-weight:bold"">Note:</span></p><p>Maintain cultural sensitivity for the UAE (no religious symbolism beyond general festive visuals)</p><p> </p>","2025-december-743079","e5a8f142-b45d-4375-973d-f0cc776663e1","/strategy/2025-december-743079",11,4
"Calvo - December 2025 - Social Media & Content Strategy","bd2f0d97-fc64-4cf1-9037-bbae217291e5",2025-12-05T07:44:15Z,2026-01-06T11:06:22Z,"01f011dc-8d52-4de4-9524-780ccef3313b","6a782226-83c3-4c2b-a265-c2be8ad567b6","december","11","2025","<p><span style=""font-weight:bold"">Objectives:</span></p><p>Establish decisive market entry and cultural resonance by consistently communicating the brand&#x27;s authentic Spanish heritage and superior quality, while strategically showcasing its versatility to integrate seamlessly into diverse Jordanian family recipes and everyday meals, thereby driving consumer trial and adoption.</p><p> </p><p>Following the launch in November, December&#x27;s strategy will continue to emphasise Mediterranean quality, authentic Spanish heritage, and visually compelling meal inspiration that highlights Calvo Tuna as the premium-yet-accessible brand for every Jordanian table.</p><p> </p><p>This month follows this direction:</p><ol><li><span style=""font-weight:bold"">Cultural Localization:</span> Blend Calvo’s Spanish soul with local Jordanian culture to drive emotional connection and acceptance (e.g., using Calvo in local favorite meals).</li><li><span style=""font-weight:bold"">Education &amp; Versatility:</span> Communicate Calvo’s Spanish origins, quality, and versatility as a high-protein, healthy ingredient in daily and family meals.</li><li><span style=""font-weight:bold"">Engagement &amp; Conversion:</span> Build community through interactive content to encourage trial and drive retail visibility.</li></ol><p> </p><p><span style=""font-weight:bold"">Content Deliverables:</span></p><p>1 Reel</p><p>5 Static/Carousels  </p><p>4 Stories</p><p> </p><p><span style=""font-weight:bold"">Content Pillars:</span></p><p><span style=""font-weight:bold"">1. Brand &amp; Product Education</span></p><p><span style=""font-weight:bold"">Goal:</span> To communicate Calvo’s Spanish origins, quality process, and nutritional superiority, establishing it as a premium-yet-accessible protein partner.</p><p><span style=""font-weight:bold"">What&#x27;s new this month:</span></p><ul><li>Focus on <span style=""font-weight:bold"">&quot;From Spain to Jordan&quot;</span> journey and heritage (e.g., &quot;Why Everyone in Spain Loves Calvo&quot;).</li><li>Highlight the high protein, low fat, and Omega-3 benefits using simple infographics.</li></ul><p> </p><p><span style=""font-weight:bold"">2. Lifestyle &amp; Recipe Inspiration</span></p><p><span style=""font-weight:bold"">Goal:</span> To demonstrate Calvo’s versatility by providing easy, healthy, Mediterranean-inspired recipes that fit the modern Jordanian lifestyle.</p><p><span style=""font-weight:bold"">What&#x27;s new this month:</span></p><ul><li>Showcase recipes that are <span style=""font-weight:bold"">&quot;Fast, fresh, and full of flavor&quot;</span> (e.g., Tuna Fettuccine Mediterranean Style).</li><li>Use step-by-step carousels and visually appealing food photography.</li></ul><p> </p><p><span style=""font-weight:bold"">3. Cultural Localization</span></p><p><span style=""font-weight:bold"">Goal:</span> To build connection by seamlessly integrating Calvo into familiar Jordanian meals and flavor profiles.</p><p><span style=""font-weight:bold"">What&#x27;s new this month:</span></p><ul><li>Focus on <span style=""font-weight:bold"">&quot;Tuna Your Way&quot;</span> by featuring local favorites (From Maqluba to Tabbouleh) reimagined with Calvo.</li><li>Leverage cultural touchpoints to show how the brand fits right in.</li></ul><p> </p><p><span style=""font-weight:bold"">4. Engagement &amp; Community</span></p><p><span style=""font-weight:bold"">Goal:</span> To build an interactive community and increase followers by using relatable and fun content.</p><p><span style=""font-weight:bold"">What&#x27;s new this month:</span></p><ul><li>Implement interactive Stories (Polls, Quizzes) such as <span style=""font-weight:bold"">&quot;Which Calvo Dish Are You?&quot;</span> or &quot;Guess the Ingredient.&quot;</li><li>Promote conversation with questions encouraging followers to share their favorite tuna meals.</li></ul><p> </p><p><span style=""font-weight:bold"">Notes:</span></p><p>To sustain the launch momentum and ensure a strong finish to the year, boosted posts should focus on Conversion (product visibility) and Education (nutrition/quality), with a strong emphasis on blending the Spanish heritage with authentic Jordanian flavor and family moments.</p>","2025-december-404666","40a8a1f7-5a78-4af6-b050-00f2e457ee04","/strategy/2025-december-404666",11,4
,"c5624c6d-1afd-4b40-ae3e-37d90a0501db",2025-10-01T08:14:13Z,2026-01-06T11:06:22Z,"01f011dc-8d52-4de4-9524-780ccef3313b","cf43c9d2-0680-46a6-bfb1-614177099a56","february","1","2025",,"2025-february-73693","e1d94d72-9ae6-42d9-89d5-694115a43c97","/strategy/2025-february-73693",,
"Alkalive Jordan - December 2025 - Social Media & Content Strategy","cad50117-5fd8-48d5-bb21-602d9eedc9fe",2025-12-05T13:11:21Z,2026-01-06T11:06:22Z,"01f011dc-8d52-4de4-9524-780ccef3313b","ba7b39b5-2f96-4c6b-8d55-9e6c7cbd3ea4","december","11","2025","<p><span style=""font-weight:bold"">Objectives:</span></p><p>Drive consumer conversion through scientific differentiation and lifestyle alignment by executing targeted educational content that clearly substantiates the superior pH and mineral advantages of the water, establishing Alkalive as the trusted, premium choice for high-performance hydration and modern wellness routines.</p><p> </p><p>Following November&#x27;s results, December&#x27;s strategy will continue to emphasise consistent content, education, and visually compelling posts that highlight Alkalive as the premium alkaline water brand designed to energise modern, health-conscious Jordanians.</p><p> </p><p><span style=""font-weight:bold"">This month follows this direction:</span></p><ol><li><span style=""font-weight:bold"">Educate &amp; Differentiate:</span> Simplify the science behind alkaline water (pH balance, minerals, fast absorption).</li><li><span style=""font-weight:bold"">Foster Lifestyle Connection:</span> Position Alkalive as part of an aspirational, active, and mindful Jordanian lifestyle.</li><li><span style=""font-weight:bold"">Address Seasonal Wellness:</span> Focus on the importance of hydration and balance during the winter months.</li></ol><p><span style=""font-weight:bold"">Content Deliverables:</span></p><p> </p><p>5 Static/Carousels</p><p>1 Reel </p><p>4 Stories</p><p> </p><p><span style=""font-weight:bold"">Content Pillars:</span></p><p> </p><p><span style=""font-weight:bold"">1. Education &amp; Differentiation</span></p><p><span style=""font-weight:bold"">Goal:</span> To simplify the science behind alkaline water (pH balance, minerals, hydration) and highlight what makes Alkalive a scientifically backed, premium water brand.</p><p><span style=""font-weight:bold"">What&#x27;s new this month:</span></p><ul><li><span style=""font-weight:bold"">Explaining Alkalive’s pH &amp; mineral advantage</span> (pH 8–8.5, rich minerals, fast absorption).</li><li>Side-by-side comparison of alkaline vs. regular water benefits.</li><li>Minimal infographic style content to communicate science simply.</li></ul><p> </p><p><span style=""font-weight:bold"">2. Lifestyle &amp; Community</span></p><p><span style=""font-weight:bold"">Goal:</span> To connect Alkalive to real Jordanian lifestyles, positioning it as an essential part of an aspirational, active, and mindful lifestyle.</p><p><span style=""font-weight:bold"">What&#x27;s new this month:</span></p><ul><li>Content showcasing everyday hydration moments in Jordan (work, gym, cafe, commuting).</li><li>Emphasis on the theme: <span style=""font-weight:bold"">&quot;This Is What Balance Looks Like.&quot;</span></li><li>Using local settings and relatable visuals to build community trust.</li></ul><p> </p><p><span style=""font-weight:bold"">3. Trust &amp; Transparency</span></p><p><span style=""font-weight:bold"">Goal:</span> To build credibility and trust by showcasing Alkalive&#x27;s quality, purity, and authenticity.</p><p><span style=""font-weight:bold"">What&#x27;s new this month:</span></p><ul><li>Content focusing on the Alkalive water source &amp; quality.</li><li>Highlighting the purification process and premium look.</li><li>Encouraging engagement by asking what keeps followers balanced daily.</li></ul><p> </p><p><span style=""font-weight:bold"">4. Seasonal Wellness &amp; Education</span></p><p><span style=""font-weight:bold"">Goal:</span> To address season-specific hydration needs, focusing on the importance of staying properly hydrated even during cold weather, supporting energy and immunity.</p><p><span style=""font-weight:bold"">What&#x27;s new this month:</span></p><ul><li>Content focusing on the Importance of hydration during winter.</li><li>Cozy winter aesthetic and seasonal cues to reinforce relevance.</li><li>Post scheduled for early January to kickstart the New Year&#x27;s focus on health.</li></ul><p> </p><p><span style=""font-weight:bold"">Notes:</span></p><p>To sustain consistency and ensure the brand maintains its bold yet human tone, all creative assets must adhere to the visual goal: Clean, airy, real-life Jordan moments, diverse, inclusive, and aspirational. The immediate focus remains on Launch Awareness and Education.</p>","2025-december-671389","18b7a26f-7f8a-456f-a7c6-d26aa1535fec","/strategy/2025-december-671389",11,4
,"d3276bf8-af60-4bf9-9daf-4de8398e3fcc",2025-12-18T12:28:22Z,2026-01-06T11:06:22Z,"01f011dc-8d52-4de4-9524-780ccef3313b","b7444ad8-e438-49ce-b78a-df4a2ed60dd8","december","11","2025",,"2025-december-583012","c4723d06-5b05-482c-b318-5472ec4c334f","/strategy/2025-december-583012",,
"Elite Recruitment - Q1 2026 - Social Media Marketing Strategy","e1782c13-eea5-4fe6-8c55-82d3c6d380d4",2026-01-21T08:19:48Z,2026-01-26T07:30:13Z,"01f011dc-8d52-4de4-9524-780ccef3313b","5f4622df-b55f-43d6-9ff8-3eac20caf538",,"0","2026",,"2026-january-454934","41599ce5-0074-454c-a2ec-8706540b238d","/strategy/2026-january-454934",2,1
,"e4b008ce-7775-457c-81dd-9b2485c274bc",2025-10-01T09:31:47Z,2026-01-06T11:06:22Z,"01f011dc-8d52-4de4-9524-780ccef3313b","be5a7ff1-e84f-43fb-b6de-579ec9c8315d","august","7","2025",,"2025-august-217947","7557f5a6-ad5d-47aa-a0b6-8aa0c8f4009f","/strategy/2025-august-217947",,
"Elite Property DXB - September 2025 - Social Media & Website Blog Strategy","f33b8bfe-c2f0-472e-bb81-6a873aa3f3af",2025-08-25T16:53:54Z,2026-01-06T11:06:22Z,"01f011dc-8d52-4de4-9524-780ccef3313b","5dd8d88e-58bc-4e12-9cfb-55a3306b21cd","september","8","2025","<p><span style=""font-weight:bold"">Objective:</span></p><p> </p><p>Position Elite Property DXB as a trusted, aspirational real estate brand by:</p><ul><li>Leading with lifestyle storytelling (buyers see their dream life).</li><li>Humanising Elite culture (agents see their dream career and are inspired to join, bringing in more agents).</li><li>Providing credible insights (everyone sees Elite as the authority).</li></ul><p>Move away from salesy, cookie-cutter reels. Instead, create experiences, narratives, and insights that make Elite stand out.</p><p> </p><p><span style=""font-weight:bold"">Theme</span></p><p>Beyond the Property, It’s About the Lifestyle</p><p> </p><p><span style=""font-weight:bold"">Content Pillars</span></p><p>1. Lifestyle (Storytelling Around Properties &amp; Communities)</p><p> </p><p>Why? Because people buy into lifestyles, not just walls and roofs.</p><p>How? Create cinematic, story-led property and community tours that let viewers imagine themselves living there. Focus on moments, feelings, and experiences rather than just listing specs.</p><p> </p><p>For Buyers: “I can see myself living there.”</p><p>For Agents: “I want to sell properties that feel like this.”</p><p> </p><p>Examples:</p><p>Morning coffee on a balcony with a sea view.</p><p>Families enjoying the community park.</p><p> </p><p>A walk-through that feels like a lifestyle ad, not a sales pitch.</p><p> </p><p><span style=""font-weight:bold"">2. Life at Elite (The Culture &amp; Growth)</span></p><p>Why? Because Elite is more than a brokerage, it’s a lifestyle brand and career path.</p><p>How? Share human, relatable stories of the Elite team to attract talent and build trust.</p><p> </p><p>Angles to explore:</p><p>Career Growth: Agents sharing their journey from where they started to where they are now.</p><p>Me Before vs. Me Now: Transformation stories (money, lifestyle, confidence).</p><p>Culture &amp; Camaraderie: Show how Elite celebrates wins, supports agents, and creates a family-like environment.</p><p> </p><p>For New Agents: “I want to be part of that team.”</p><p>For Buyers: “I trust agents who love where they work.”</p><p> </p><p><span style=""font-weight:bold"">3. Educational (Insights &amp; Credibility)</span></p><p>Why? Because credibility = trust, and trust = clients + agents.</p><p>How? Share short, snackable insights and data points that position Elite as the go-to expert in Dubai’s real estate market.</p><p> </p><p>Content formats:</p><p> </p><p>Market Insights: “Why Palm Jumeirah homes are seeing record demand.”</p><p>Quick Facts: Bite-sized posts/reels with surprising property facts.</p><p>Tips: Buyer advice, agent growth tips, investment know-how.</p><p> </p><p>For Buyers: “This brand knows what they’re talking about, I can trust them.”</p><p>For Agents: “This is a place where I can learn and grow.”</p><p> </p><p><span style=""font-weight:bold"">Grid &amp; Aesthetic Direction</span></p><p> </p><p>Visual Anchor: Lifestyle remains the hero. Properties and communities are shot in a cinematic, aspirational style.</p><p>Life at Elite content blends seamlessly, agents shown in the same aesthetic (so they look like the lifestyle, not just behind desks).</p><p>Educational content is presented clean, modern, and on-brand (quick hits of value, still visually elevated).</p><p> </p><p>For Agents: “I want to be like them.”</p><p>For Buyers: “I want to live there.”</p><p> </p><p><span style=""font-weight:bold"">References</span></p><p> </p><p><span style=""font-weight:bold"">Property Spotlight / Lifestyle</span></p><ul><li>https://www.instagram.com/reel/C7Cx-URyhmD/?igsh=cHZldHp4dWN3bmxk</li><li>https://www.instagram.com/reel/DNBMK00I59j/?igsh=dzd5b2RuemVxZmVv</li><li>https://vt.tiktok.com/ZSAyugDX3/</li></ul><p><span style=""font-weight:bold"">Community Storytelling</span></p><ul><li>https://vt.tiktok.com/ZSAyHyQ4n/</li><li>https://www.instagram.com/reel/DKsitgGRrqe/?igsh=MWVoYXQ5NXlpcWRjMw==</li></ul>","2025-september-710659","56eac7e9-af94-47c0-b4b1-2a4101a9b0c1","/strategy/2025-september-710659",8,3
"Crypto Homes DXB - August 2025 - Social Media Strategy","f41a2e6b-986f-4ea6-91be-18b5a9a6d201",2025-08-03T19:54:13Z,2026-01-06T11:06:22Z,"01f011dc-8d52-4de4-9524-780ccef3313b","90f5bb8e-1da9-441f-b63b-1941b663318b","august","7","2025","<p>In Month 2, the focus for Crypto Homes DXB is to grow <span style=""font-weight:bold"">brand visibility, credibility, and audience engagement</span> by leveraging platform-specific strengths and delivering value-driven content. The strategy includes:</p><ul><li><span style=""font-weight:bold"">Establishing Crypto Homes DXB as a pioneer</span> in crypto-powered real estate through consistent and clear messaging.</li><li><span style=""font-weight:bold"">Prioritising Instagram and TikTok</span> with short-form video content (Reels) that educates, entertains, and builds trust.</li><li><span style=""font-weight:bold"">Delivering 8 Reels, 6 static/carousel posts, and 3 Stories per week</span> to maintain consistency and boost algorithm visibility.</li><li><span style=""font-weight:bold"">Highlighting Dubai real estate projects</span> and crypto FAQs to attract a broader, curious audience.</li><li><span style=""font-weight:bold"">Positioning the brand as credible on LinkedIn</span> with insights, thought leadership content, and reposts from founders or team members.</li><li><span style=""font-weight:bold"">Monitoring Facebook’s role</span> as a repurposing or niche ad platform with minimal resource allocation.</li><li><span style=""font-weight:bold"">Focusing on brand awareness and education only</span> — no lead gen campaigns this month.</li></ul>","2025-august-29250","cc1e8c94-1f3d-4942-ba0a-3f5041a105cc","/strategy/2025-august-29250",8,3
