"Title","ID","Created Date","Updated Date","Owner","project","monthText","month","year","strategy","slug","company","Strategy","monthEnd","quarter"
,"0388da1f-0f1a-4df2-a1e3-c262e599ffcf",2025-10-01T09:32:24Z,2026-01-06T11:06:22Z,"01f011dc-8d52-4de4-9524-780ccef3313b","62980c2d-3d5b-4488-8b5e-83dc24f687b3","august","7","2025",,"2025-august-744937","ac8e2429-cd88-4f8a-97b3-cfb7abb2e4f9","/strategy/2025-august-744937",,
"Code DXB - Q1 2026 - Social Media & Marketing Strategy","04bc6a59-b666-45d0-8287-0cd106eb3e6d",2026-01-07T06:58:00Z,2026-01-26T07:30:13Z,"01f011dc-8d52-4de4-9524-780ccef3313b","b7444ad8-e438-49ce-b78a-df4a2ed60dd8",,"0","2026","<p><span style=""font-weight:bold"">Code DXB - Q1 2026 Social Media Strategy</span></p><p>Stage 1 (January - March 2026)</p><p> </p><p>Position Code DXB as the UAE’s definitive guide to practical AI adoption, targeting HR, L&amp;D, enterprise leaders, and tech solution providers. The content will educate, debunk myths, and convert curiosity into actionable adoption. Social media will act as the pre-event knowledge hub, registration driver, and ecosystem builder.</p><p> </p><p><span style=""font-weight:bold"">Target Audience</span></p><ul><li>Enterprise leaders: C-suite, Directors, Department Heads: decision-makers for AI adoption.</li><li>HR &amp; L&amp;D professionals: Decision-makers in talent and learning functions.</li><li>Digital transformation &amp; IT teams: AI implementation facilitators.</li><li>Government &amp; policy influencers: Regulators and AI governance stakeholders.</li><li>AI &amp; tech vendors: B2B solution providers targeting enterprise adoption.</li></ul><p> </p><p><span style=""font-weight:bold"">Behavioural drivers: </span>curious, forward-thinking, fast decision-making, professional, solution-driven.</p><p> </p><p><span style=""font-weight:bold"">Posting Frequency</span>: </p><p>January: 4 Reels + 4 Statics</p><p>February-March: 2 Reels + 2 Statics</p><p> </p><p><span style=""font-weight:bold"">Primary Goal:</span></p><ul><li>In January, the focus will be on <span style=""font-weight:bold"">brand awareness</span>, with content designed to educate the audience and drive engagement.</li><li>In February and March, the focus will shift to <span style=""font-weight:bold"">brand promotion </span>(Why Exhibit, Call for Speakers, Brochure).</li></ul><p> </p><p><span style=""font-weight:bold"">Content Pillars:</span></p><p>1. AI Awareness &amp; Education</p><p><span style=""font-style:italic"">Goal: Help the audience understand AI’s practical applications and clear confusion around adoption.</span></p><p> </p><p>Formats:</p><p>Reels (question-based, POV), Carousels (step-by-step guides, myth-busting).</p><p> </p><p>Content Focus:</p><p>Ask questions that reveal AI challenges; share practical insights; present frameworks and checklists.</p><p> </p><p>2. Credibility &amp; Case Studies</p><p><span style=""font-style:italic"">Goal: Build trust by showcasing real-world AI adoption examples and measurable business outcomes.</span></p><p> </p><p>Formats:</p><p>LinkedIn Articles, Carousel explainers.</p><p> </p><p>Content Focus: Regulatory guidance, frameworks, practical tips for safe and effective AI implementation, HR, L&amp;D, and enterprise success stories; statistics and metrics; expert quotes.</p><p> </p><p>3. Exhibitor &amp; Event Promotion</p><p><span style=""font-style:italic"">Goal: Position Code DXB as the premier platform to exhibit AI solutions to decision-makers.</span></p><p> </p><p>Formats:</p><p>Reels (benefits, ROI, attendee profiles), Carousels (3 Reasons to Exhibit, exhibitor testimonials)</p><p> </p><p>Content Focus: “Why Exhibit?”, showcasing audience types, urgency-driven registration.</p>","2026-january-583012","c4723d06-5b05-482c-b318-5472ec4c334f","/strategy/2026-january-583012",2,1
,"0822aa8b-05ca-4e19-9727-94af864165b0",2025-10-01T09:31:38Z,2026-01-06T11:06:22Z,"01f011dc-8d52-4de4-9524-780ccef3313b","be5a7ff1-e84f-43fb-b6de-579ec9c8315d","october","9","2025",,"2025-october-217947","7557f5a6-ad5d-47aa-a0b6-8aa0c8f4009f","/strategy/2025-october-217947",,
"Elite Property DXB - November 2025 - Social Media & Website Blog Strategy","0d19324c-4205-4bf9-94ba-a54adc7bbe12",2025-10-29T14:39:05Z,2026-01-06T11:06:22Z,"01f011dc-8d52-4de4-9524-780ccef3313b","5dd8d88e-58bc-4e12-9cfb-55a3306b21cd","november","10","2025","<p><span style=""font-weight:bold"">Overview</span></p><p>Starting this November, our social media performance will shift from focusing on month-over-month percentage increases to maintaining a consistent KPI range across platforms for 6 months and then evaluated thereafter based on the previous 6 months performance.</p><p> </p><p>The account has now reached a stable and mature growth stage, meaning the priority is consistency in reach, engagement, and content quality rather than chasing spikes each month.</p><p> </p><p>By tracking within a healthy performance range, we ensure Elite’s content maintains steady visibility and engagement that reflects the brand’s established authority in the Dubai luxury real estate market.</p><p> </p><p><span style=""font-weight:bold"">November Objectives</span></p><p>November’s strategy focuses on depth over volume, building stronger emotional resonance through human-led storytelling, property lifestyle narratives, and credible market insight.</p><p>We will continue positioning Elite as the benchmark for premium Dubai real estate while strengthening its presence among both buyers and agents through authentic, aspirational, and insight-driven content.</p><p> </p><p><span style=""font-weight:bold"">Core Goals</span></p><ul><li>Maintain consistent reach and engagement across all platforms within the defined KPI range.</li><li>Drive community engagement through storytelling and agent-focused content.</li><li>Continue blending lifestyle, property, and human elements to strengthen brand trust.</li><li>Reinforce Elite’s image as a desirable brand for both clients and aspiring agents.</li></ul><p> </p><p><span style=""font-weight:bold"">Theme</span></p><p>Beyond the Property: Lifestyle, People, and Perspective</p><p> </p><p>Elite continues to represent more than just real estate. It is about lifestyle, ambition, and the people behind the brand.</p><p> </p><p><span style=""font-weight:bold"">Core Content Pillars</span></p><p> </p><p><span style=""font-weight:bold"">1. Lifestyle Storytelling</span></p><p>Why: Buyers connect with lifestyle, not listings.<br/>How: Create immersive, cinematic content that captures the feeling of Dubai living.</p><p> </p><p><span style=""font-weight:bold"">2. Life at Elite (Culture &amp; Growth)</span></p><p>Why: Humanising the brand makes it relatable and aspirational, especially for new agents.<br/>How: Showcase team culture, achievements, and real stories from within Elite.</p><p> </p><p><span style=""font-weight:bold"">3. Educational Insights</span></p><p>Why: Knowledge builds credibility and credibility builds trust.<br/>How: Deliver short, informative insights in modern, minimalist formats.</p><p> </p><p><span style=""font-weight:bold"">4. Agent-Focused and Area Specialist Reels</span></p><p>Why: Reinforce expertise and personal branding for Elite agents.<br/>How: Position agents as local experts who own their area.</p><p> </p><p><span style=""font-weight:bold"">5. Work with Elite (Recruitment Content)</span></p><p>Why: Build credibility and attract quality agents to join the brand.<br/>How: Present Elite as a growth-driven, empowering, and high-performing workplace.</p><p> </p><p><span style=""font-weight:bold"">6. CSR and Community Activities</span></p><p>Why: A brand that gives back earns trust and emotional connection.<br/>How: Highlight Elite’s participation in social, charity, and industry events.</p><p> </p><p><span style=""font-weight:bold"">7. Agent Spotlight</span></p><p>Why: Celebrate individuality and success within the team.<br/>How: Feature one agent per week across stories and posts.</p><p> </p><p><span style=""font-weight:bold"">Summary</span></p><p>In November, Elite’s strategy will:</p><ul><li>Prioritise consistency and quality over fluctuation.</li><li>Focus on storytelling that sells lifestyle and credibility.</li><li>Strengthen Elite’s internal culture and agent brand visibility.</li><li>Maintain performance within healthy KPI ranges that reflect a stable, growing brand.</li></ul><p> </p><p>Elite’s story continues beyond the property.</p>","2025-november-710659","56eac7e9-af94-47c0-b4b1-2a4101a9b0c1","/strategy/2025-november-710659",11,4
,"13abd757-584a-40f6-bb4b-dd413979b323",2025-11-14T08:19:35Z,2026-01-06T11:06:22Z,"01f011dc-8d52-4de4-9524-780ccef3313b","b7444ad8-e438-49ce-b78a-df4a2ed60dd8","november","10","2025","<p>Stage 1 (Nov 17 - April 2026): Brand Awareness Campaign</p><p> </p><p><span style=""font-weight:bold"">Strategy Overview</span></p><p>A 6-month &quot;Problem-First&quot; narrative campaign on LinkedIn. Our strategy will lead with the pressing, unresolved questions in the HR and Education sectors regarding AI. Each month will systematically build from identifying the problem, exploring the consequences, hinting at solutions, and finally, introducing Code DXB as the essential answer. The single weekly post will be high-value and high-impact to cut through the corporate noise.</p><p> </p><p><span style=""font-style:italic"">Goal: Build a recognised and trusted brand identity for Code DXB as the definitive thought leader on practical AI application in HR and Education.</span></p><p> </p><p><span style=""font-weight:bold"">Target Audience</span></p><p>Primary: C-Suite Executives, VPs of HR &amp; L&amp;D, University Deans, and Chief Innovation Officers in the UAE and wider GCC (&quot;Rule-setters &amp; Decision-makers&quot;).</p><p>Secondary: HR Managers, Tech Directors, Academic Department Heads, and AI Implementation Specialists (&quot;Industry Specialists&quot;).</p><p> </p><p><span style=""font-weight:bold"">November - December 2025: The Diagnosis</span></p><p><span style=""font-style:italic"">Focus: Articulating the core anxieties and operational challenges.</span></p><p> </p><p><span style=""font-weight:bold"">Themes:</span> &quot;Is our workforce obsolete?&quot;, &quot;The true cost of ignoring GenAI in curriculum&quot;, &quot;Data points you&#x27;re overlooking in your HR stack.&quot;</p><p> </p><p><span style=""font-weight:bold"">Formats:</span></p><ul><li>Carousel Posts: For deep-dives into data and frameworks (e.g., &quot;5 HR Policies Killing AI Adoption&quot;).</li><li>Industry News/Static Posts: Breaking AI news in the region, using a bold graphic and a strong, opinionated caption.</li><li>Reels/Videos: 15-30 second insights to highlight a key industry problem with on-screen text.</li><li>Linkedin Articles: Case Studies/Report to offer tangible proof and gated, high-value content to capture leads.</li></ul>","2025-november-583012","c4723d06-5b05-482c-b318-5472ec4c334f","/strategy/2025-november-583012",,
"Mutant 2025 - August Social Media & Website Blog Strategy","18c4e00c-cf06-410c-8823-647f55c82e82",2025-08-08T07:12:57Z,2026-01-06T11:06:22Z,"01f011dc-8d52-4de4-9524-780ccef3313b","f889f811-6e7f-489d-a7de-dee3fc249d28","august","7","2025",,"2025-august-436945","426d8f37-fc41-444b-ab15-e9fc7bbb0933","/strategy/2025-august-436945",,
"Canterra Properties - Q1 2026 - Social Media Strategy","1cc8d11e-d292-4a11-848e-bcc4758b87fd",2026-01-22T09:54:27Z,2026-01-26T07:30:13Z,"01f011dc-8d52-4de4-9524-780ccef3313b","fe578398-ead8-4e5c-902c-1ba9d28746b3",,"0","2026","<p>Canterra’s social presence will be built deliberately, prioritising identity, consistency, and authority before any performance-driven growth. The focus in Q1 is to establish a distinct visual and editorial language that defines how the brand looks, speaks, and shows up across every touchpoint in the market.</p><p> </p><p><span style=""font-weight:bold"">Content Deliverables:</span></p><p>3 reels per month</p><p>2 statics per month</p><p> </p><p><span style=""font-weight:bold"">Core Content Pillars:</span></p><p>1. Brand Identity &amp; Positioning: This pillar establishes Canterra’s minimalist and refined brand signature, clearly defining how the brand looks, speaks, and presents itself. Content focuses on communicating core brand values, introducing the Four Cs, highlighting visual identity moments, and reinforcing foundational brand statements that set the tone for long-term consistency.</p><p> </p><p><span style=""font-style:italic"">Goal: To achieve instant market recognition by owning a distinct, minimalist visual signature.</span></p><p> </p><p>Reels: </p><ul><li>The Four Cs: A rhythmic edit using clean typography overlays to define <span style=""font-style:italic"">Character, Clarity, Commitment,</span> and <span style=""font-style:italic"">Consistency.</span></li><li>Color &amp; Texture: A visually driven &quot;mood board&quot; reel that showcases the Charcoal, Orange, and Clay palette through architectural and lifestyle clips.</li></ul><p> </p><p>Statics:</p><ul><li>Foundational Statement: A &quot;Quiet Perspective&quot; post featuring the statement: <span style=""font-style:italic"">&quot;Not just a better home. A better fit.&quot;</span> </li><li>The Icon Breakdown: A high-contrast graphic of the brand mark with a minimal caption explaining the geometry of the four interlocking Cs.</li><li>Design Philosophy: A light-driven architectural shot with a small, centered text overlay explaining why Canterra is &quot;Design-led.&quot;</li></ul><p> </p><p>2. Trust &amp; Credibility: This pillar reinforces confidence through transparency and consistency, strengthening trust between Canterra and its audience. Content includes founder insights, clear explanations of processes, transaction philosophies, and messaging that consistently places client needs and long-term outcomes at the centre.</p><p> </p><p><span style=""font-style:italic"">Goal: To establish Canterra as a &quot;Trusted Advisor&quot; rather than just another brokerage. Build long-term brand equity by humanising the expertise and proving the commitment to transparent, knowledge-first guidance.</span></p><p> </p><p>Reels:</p><p>About Canterra: A documentary-style reel, discussing the vision behind Canterra and the shift toward &quot;Properties with Purpose.&quot;</p><p> </p><p>Statics:</p><p>Client Philosophy: A quote-style post focused on the &quot;Commitment&quot; pillar, detailing how we protect client interests through every stage of the transaction.</p><p> </p><p><span style=""font-weight:bold"">Notes:</span></p><ul><li>Typography: Strictly F37 Ginger Pro.</li><li>Negative Space: Ensure all statics feel &quot;airy&quot; and editorial.</li><li>Logo Usage: Adhere to the Clearspace rules (height of the &#x27;C&#x27;) to maintain a premium feel.</li><li>Tone: Always serious, confident, and bold.</li></ul>","2026-january-168008","f644f0b2-3ef9-4d0a-80c3-276de3135008","/strategy/2026-january-168008",2,1
"Airstay Holiday Homes - August 2025 - Social Media Strategy","1f1af500-f7f7-4a97-ab09-b6c9d51a414e",2025-08-04T21:10:24Z,2026-01-06T11:06:22Z,"01f011dc-8d52-4de4-9524-780ccef3313b","1212678d-037b-475a-b187-a27821e2d3c8","august","7","2025","<p><span style=""font-weight:bold"">Objective:</span> Relaunch social media presence after pausing in April, with a content mix focused on acquiring <span style=""font-weight:bold"">80% new hosts</span> and appealing to <span style=""font-weight:bold"">20% guests</span></p><p><span style=""font-weight:bold"">Primary Platforms:</span> Instagram (Reels, Carousels, Stories), LinkedIn (for host acquisition and credibility)</p><p> </p><p><span style=""font-weight:bold"">Target Audience 1: New Hosts (80%)</span></p><p> </p><p><span style=""font-weight:bold"">Goal:</span> Encourage property owners to list with Airstay by highlighting ease, income potential, and full-service support</p><p> </p><p><span style=""font-weight:bold"">Core Content Pillars:</span></p><ul><li><span style=""font-weight:bold"">Host Education</span><br/>How the process works<br/>Step-by-step onboarding<br/>Common misconceptions and FAQs</li><li><span style=""font-weight:bold"">Earning Potential</span><br/>Real examples of monthly earnings<br/>What one-bedroom, two-bedroom, or villa owners can expect</li><li><span style=""font-weight:bold"">Dubai Market Insights</span><br/>Trends in short-term rentals<br/>Why demand is high for holiday homes<br/>Off-plan property owners converting to short lets</li><li><span style=""font-weight:bold"">Trust and Support</span><br/>Testimonials from current hosts<br/>Behind-the-scenes of property management, guest services<br/>Airstay as a hands-off, professional partner</li></ul><p> </p><p><span style=""font-weight:bold"">Recommended Formats:</span></p><ul><li>Reels: “What you can earn,” “How onboarding works,” “Why owners are switching to short-term”</li><li>Carousels: “5 steps to get started,” “Top FAQs for new hosts,” “How we manage your property”</li><li>Stories: Polls, quick tips, AMAs, day-in-the-life</li><li>LinkedIn: Host success stories, market commentary, service breakdowns</li></ul><p> </p><p><span style=""font-weight:bold"">Target Audience 2: Guests (20%)</span></p><p> </p><p><span style=""font-weight:bold"">Goal:</span> Drive bookings and stay enquiries by showcasing quality properties and the Dubai lifestyle.</p><p> </p><p><span style=""font-weight:bold"">Core Content Pillars:</span></p><ul><li><span style=""font-weight:bold"">Property Highlights</span><br/>Featured listings<br/>New or seasonal stays<br/>High-performing units</li><li><span style=""font-weight:bold"">Lifestyle and Location</span><br/>Area guides (Downtown, Marina, Palm etc.)<br/>Things to do nearby<br/>Insider travel tips</li><li><span style=""font-weight:bold"">Guest Experience</span><br/>Testimonials and reviews<br/>Professional housekeeping, concierge services<br/>What to expect from an Airstay property</li></ul><p><span style=""font-weight:bold"">Recommended Formats:</span></p><ul><li>Reels: “Tour this home,” “Perfect for a long weekend,” “Inside our best-rated listing”</li><li>Stories: “Book now” features, property countdowns, travel tip series</li><li>Carousels: “3 places to stay this August,” “Top cafés near your Airstay,” “Neighbourhood spotlight”</li></ul><p> </p><p><span style=""font-weight:bold"">Stories:</span></p><ul><li>Market Insights - 2x</li><li>Engagement - 4x</li><li>Reviews or Property - 1x</li><li>Book Now - 1x</li></ul>","2025-august-743079","e5a8f142-b45d-4375-973d-f0cc776663e1","/strategy/2025-august-743079",8,3
"Airstay Holiday Homes - October 2025 - Social Media Strategy","2130fd3d-10a7-4c25-8cf2-4e9817b5ca13",2025-09-22T09:18:33Z,2026-01-06T11:06:22Z,"01f011dc-8d52-4de4-9524-780ccef3313b","1212678d-037b-475a-b187-a27821e2d3c8","october","9","2025","<p>October marks the beginning of Dubai&#x27;s peak tourism season. Our strategy is designed to capture this demand by targeting two audiences with a balanced content mix focused on acquiring new hosts (60%) and guest bookings (40%). Our focus is on creating and emphasising high-engagement formats like reels and stories to inspire staycations and travel, as well as establish Airstay AE as the most trusted and professional property management partner in the UAE.</p><p> </p><p><span style=""font-weight:bold"">Content Formats</span></p><p>Video Content - 4</p><p>Static/Carousels - 4<br/>Stories - 8</p><p>Blogs - 5</p><p> </p><p><span style=""font-weight:bold"">Target Audience 1: Host (60%)</span></p><p>As the current content mix lacks educational material for potential hosts, the aim is to share our expertise and highlight why Airstay is a reliable partner for managing their properties.</p><p> </p><p><span style=""font-weight:bold"">Content Pillars:</span></p><p>1.<span style=""font-weight:bold""> Behind the Airstay Experience:</span> Build trust with behind-the-scenes glimpses of the team and seamless management processes. </p><p><span style=""font-style:italic"">Goal: Demystify our service and build trust by showcasing our professional, systematic approach to property management.</span></p><p><span style=""font-weight:bold"">Formats:</span></p><p>Reel: guest check-in prep, packing welcome kits/personal touches, before and after property transformation </p><p>Example: &quot;From Vacant to Welcoming: Our 7-Step Process.&quot; &quot;Spend the Day with me as an Airstay staff&quot;</p><p> </p><p>2. <span style=""font-weight:bold"">Timothy&#x27;s Take:</span> Long-form insights from Timothy about property management to reinforce authority with UAE market data, expert tips on seasonal trends, and analytical takes on holiday let dynamics. </p><p><span style=""font-style:italic"">Goal: Attract savvy property investors by providing valuable, data-driven reasons to choose Airstay.</span></p><p><span style=""font-weight:bold"">Formats:</span></p><p>LinkedIn articles: market trends and personal insights, positioning Airstay as a voice of authority</p><p> </p><p><span style=""font-weight:bold"">Target Audience 2: Guest (40%)</span></p><p>We&#x27;ll create inspiring, story-driven videos that showcase amazing Airstay experiences. The focus will be on the journeys and insights of the guests: the goal is to make people dream about their next holiday.</p><p> </p><p><span style=""font-weight:bold"">Content Pillars:</span></p><p>1.<span style=""font-weight:bold""> Aspirational Property Tours:</span> High-quality, cinematic video tours of properties</p><p><span style=""font-style:italic"">Goal: Showcasing the lifestyle, not just the space.</span></p><p><span style=""font-weight:bold"">Formats:</span></p><p>Reel: Guest POV stay, walkthrough, a day in a life, property showcases</p><p>Example: “POV: You woke up in Marina to this view&quot;</p><p> </p><p>2.<span style=""font-weight:bold""> Seasonal Travel Guides:</span> Curated, seasonal, and in-house travel hacks and booking tips. The content should focus on outdoor activities, events, and the pleasant weather.</p><p><span style=""font-style:italic"">Goal: Position Airstay as the go-to expert for Dubai travel, capturing search intent related to &quot;things to do in Dubai in October&quot;.</span></p><p><span style=""font-weight:bold"">Formats:</span></p><p>Blog: highlight upcoming events and attractions, insider tips on navigating busy seasons, while plugging Aistay-managed stays as the solution</p><p>Example: &quot;Global Village Reopening: Your Ultimate October Weekend Itinerary in Dubai&quot;. &quot;The Secret to a Hassle-Free Staycation in Dubai.&quot;</p><p> </p><p>3. <span style=""font-weight:bold"">The Story Behind the Stay/Community:</span> Testimonials from guests, highlighting exceptional stays.</p><p><span style=""font-style:italic"">Goal: Build trust and social proof through authentic, relatable experiences from past guests.</span></p><p><span style=""font-weight:bold"">Formats:</span></p><p>Carousel: showcase top reviews, focus on the seamless booking process, the perfect location, and the amenities. </p><p>Example: &quot;What Guests Love Most About Staying with Airstay&quot; </p><p> </p><p><span style=""font-weight:bold"">Recommendation:</span></p><p>1. Increase reels output to at least 4 this month as it was our top-performing format in September. </p><p>2. To strengthen Airstay&#x27;s brand authority, we begin publishing blogs and LinkedIn articles. </p>","2025-october-743079","e5a8f142-b45d-4375-973d-f0cc776663e1","/strategy/2025-october-743079",11,4
